{
  "schema": "mavconn-registry-index/v1",
  "registry_id": "dev.maverick.connectors",
  "revision": 1,
  "generated_at_ms": 0,
  "valid_until_ms": 4102444800000,
  "previous_index_sha256": null,
  "revocation_revision": 1,
  "entries": [
    {
      "connector_id": "dev.maverick.generic-hr",
      "version": "1.0.0",
      "artifact_sha256": "68386e9d4c34f901183a00b746f790925dce049f9ed5086569e477a4b484bc98",
      "artifact_url": "https://github.com/sennnen/maverick-connectors/releases/download/registry-v1/sha256-68386e9d4c34f901183a00b746f790925dce049f9ed5086569e477a4b484bc98.mavconn",
      "artifact_size": 156568,
      "publisher_key_id": "maverick-whoop-live-test",
      "abi": {
        "major": 1,
        "min_minor": 0,
        "max_minor": 0
      },
      "core": {
        "min_version": "0.1.0",
        "max_version": null
      },
      "channel": "stable",
      "supersedes": null,
      "revoked": false
    },
    {
      "connector_id": "dev.maverick.whoop4",
      "version": "1.0.2",
      "artifact_sha256": "43039ce95960505f465ae6c11fb6014e97b3852d5d95add28f8f9a6a1e15ff14",
      "artifact_url": "https://github.com/sennnen/maverick-connectors/releases/download/registry-v1/sha256-43039ce95960505f465ae6c11fb6014e97b3852d5d95add28f8f9a6a1e15ff14.mavconn",
      "artifact_size": 172242,
      "publisher_key_id": "maverick-whoop-live-test",
      "abi": {
        "major": 1,
        "min_minor": 0,
        "max_minor": 0
      },
      "core": {
        "min_version": "0.1.0",
        "max_version": null
      },
      "channel": "stable",
      "supersedes": null,
      "revoked": false
    },
    {
      "connector_id": "dev.maverick.whoop5",
      "version": "1.0.5",
      "artifact_sha256": "e9b5f0ee29c4836bf1013983bff2f82c2d6d6c932fd491a81a0606a6b31932d5",
      "artifact_url": "https://github.com/sennnen/maverick-connectors/releases/download/registry-v1/sha256-e9b5f0ee29c4836bf1013983bff2f82c2d6d6c932fd491a81a0606a6b31932d5.mavconn",
      "artifact_size": 215121,
      "publisher_key_id": "maverick-whoop-live-test",
      "abi": {
        "major": 1,
        "min_minor": 0,
        "max_minor": 0
      },
      "core": {
        "min_version": "0.1.0",
        "max_version": null
      },
      "channel": "stable",
      "supersedes": null,
      "revoked": false
    }
  ],
  "revocations": [],
  "rotations": []
}
